{
  "window_label": "5y",
  "as_of": "2026-05-21",
  "source_run_id": "local",
  "window_start": "2026-05-12",
  "window_end": "2026-05-21",
  "valid_tickers": [
    "ABEV3.SA",
    "ALOS3.SA",
    "ALPA4.SA",
    "ASAI3.SA",
    "B3SA3.SA",
    "BBAS3.SA",
    "BBDC4.SA",
    "BBSE3.SA",
    "BPAC11.SA",
    "BRAV3.SA",
    "BRKM5.SA",
    "CMIG4.SA",
    "CSAN3.SA",
    "CSNA3.SA",
    "CVCB3.SA",
    "CYRE3.SA",
    "ENEV3.SA",
    "ENGI11.SA",
    "EQTL3.SA",
    "EZTC3.SA",
    "FLRY3.SA",
    "GGBR4.SA",
    "GOAU4.SA",
    "HAPV3.SA",
    "HYPE3.SA",
    "ITSA4.SA",
    "ITUB4.SA",
    "KLBN11.SA",
    "LREN3.SA",
    "MGLU3.SA",
    "MRVE3.SA",
    "MULT3.SA",
    "PETR3.SA",
    "PETR4.SA",
    "PRIO3.SA",
    "RADL3.SA",
    "RAIZ4.SA",
    "RDOR3.SA",
    "RENT3.SA",
    "SANB11.SA",
    "SBSP3.SA",
    "SLCE3.SA",
    "SMTO3.SA",
    "TAEE11.SA",
    "TOTS3.SA",
    "UGPA3.SA",
    "USIM5.SA",
    "VALE3.SA",
    "VAMO3.SA",
    "WEGE3.SA"
  ],
  "excluded_tickers": []
}